review_id,suggested_decision,human_decision,audience,audience_label,port,type,status,category,question,desc,original_answer,suggested_answer,attachment,source_sheet,date,customer,manager,owner,review_note,score
fb-approval-0321,建议入库,,teacher,老师库,老师,操作疑问,已处理,作业/布置/批改/反馈,这份是B02，根据系统显示，总共用时3000秒左右，就是50分钟。考试规定是35分钟。到了35分钟，系统会自动停止吗？,学生考试规定是35分钟。到了35分钟，系统会自动停止吗,老师布置作业时选择结束自动停止 ，就会停止,老师布置作业时选择结束自动停止 ，就会停止,c62762a651521b75067b8a70607e346.png,客户数据2月,2023-02-19 00:00:00,有明,,,,46
fb-approval-0322,建议入库,,teacher,老师库,老师,操作疑问,已处理,作业/布置/批改/反馈,老师手动批改完后她答对的是20个，总数70个正确率28.5%，但分数显示37,学生答对的是20个，总数70个正确率28.5%，但分数显示37，分数不对,按空格计分，就是70个单词，但是实际是140个空格，按照对的比例记分,按空格计分，就是70个单词，但是实际是140个空格，按照对的比例记分,ae1b5b2c2367512ea37f7c020d12395.png,客户数据2月,2023-02-08 00:00:00,飞虎,,,,46
fb-approval-0323,建议入库,,teacher,老师库,老师,操作疑问,已处理,作业/布置/批改/反馈；小程序/公众号/二维码,我想问下手机也可以布置作业的吧。用小程序还是网页,手机用小程序还是网页布置作业,"现在手机网页操作可能不太适配,手机可以使用小程序布置打卡，自定义，常用作业",老师，您可以先确认作业是否已经成功布置、学生是否在对应班级内，以及作业状态是否已提交/已完成；如果状态正常但仍看不到，再提供学生账号和作业链接转人工排查。,5c9542db045fdb3e9eeafb90ff3bcc3.jpg,企业版用户,2023-03-23 00:00:00,XY,,,,46
fb-approval-0324,建议入库,,teacher,老师库,老师,操作疑问,已处理,作业/布置/批改/反馈；题库/录题/单词书/模考,其次关于词汇的布置，我们老师按照lesson/list上传的，目前来看布置的时候没有选择list，只能从整个书里面抽取，请问如何按照list或者多个list里面进行挑选布置,单词测试如何布置多个list,"单词书布置是下发整本单词书给学生，所以不能选择某个list,抽查可以布置多个单元，可以在布置作业-基础练习-单词中布置单独的一个或多个list","单词书布置是下发整本单词书给学生，所以不能选择某个list,抽查可以布置多个单元，可以在布置作业-基础练习-单词中布置单独的一个或多个list",1403a7c6cd00fb05f509e96cd1d99ac.jpg,企业版用户,2023-11-17 00:00:00,芝青藤,,,,46
fb-approval-0325,建议入库,,teacher,老师库,老师,使用问题,已处理,作业/布置/批改/反馈；题库/录题/单词书/模考,这个是什么意思？加入我要布置100-200的单词范围，只选择其中60个让学生抽测,布置单词作业时提示超出题库范围,选择单词数开始的数量不对，应该为第1—30个,老师，您可以先确认作业是否已经成功布置、学生是否在对应班级内，以及作业状态是否已提交/已完成；如果状态正常但仍看不到，再提供学生账号和作业链接转人工排查。,c0d5a3385b3fe2bef9dbebd394605ec.png,企业版用户,2023-09-19 00:00:00,杭州合一,,,,46
fb-approval-0326,建议入库,,teacher,老师库,老师,使用问题,已处理,作业/布置/批改/反馈；题库/录题/单词书/模考,想请问一下，平时发现错误的词汇，我在单词书里更正了，但是布置多次后还是错误的。是不是这两者没有联系,错误的词汇，我在单词书里更正了，但是布置多次后还是错误的,单词书修改的是分单元的这个，布置错原词表了,单词书修改的是分单元的这个，布置错原词表了,071f4f27bcbc47f0d97320a8b04dfebd_.jpg,企业版用户,2023-07-30 00:00:00,青澜,,,,46
fb-approval-0327,建议入库,,teacher,老师库,老师,使用问题,已处理,作业/布置/批改/反馈；题库/录题/单词书/模考,老师，自有题库，标红的那里，我录入的时候设置了空格，为什么预览的时候，包括布置的时候，空格没有了，辛苦您给看一下,自有题库材料复制到题库后，没有空行,格式问题，可能是复制过来带的格式，老师可以手动编辑一下,格式问题，可能是复制过来带的格式，老师可以手动编辑一下,47368163107e4242cd30ad85f8920af.png,企业版用户,2023-07-16 00:00:00,睿途,,,,46
fb-approval-0328,建议入库,,teacher,老师库,老师,使用问题,已处理,作业/布置/批改/反馈；题库/录题/单词书/模考,学生已经完成了作业 但是没有分数，请求看看一下,学生已经完成了作业 但是没有显示分数,开启了模考成绩审核后发布，需要老师在结果页发布成绩学生才能看到,老师，您可以先确认作业是否已经成功布置、学生是否在对应班级内，以及作业状态是否已提交/已完成；如果状态正常但仍看不到，再提供学生账号和作业链接转人工排查。,70b65ae349db9e496acac029fd68341.png,企业版用户,2023-06-21 00:00:00,寸心,,,,46
fb-approval-0329,建议入库,,teacher,老师库,老师,操作疑问,已处理,作业/布置/批改/反馈；题库/录题/单词书/模考,你好 如果我想布置全部33个单元的其中某几个单元的学习和检测，我勾选对应的Unit是不是就可以了？如果我不勾选，默认是布置的整本书吗？,布置单词书全部33个单元的其中某几个单元的学习和检测，我勾选对应的Unit是不是就可以了？如果我不勾选，默认是布置的整本书吗？,布置就是布置一整本单词书 点击选择列表是布置抽查作业,布置就是布置一整本单词书 点击选择列表是布置抽查作业,eaa18ea498dc578b407fda23bcf08d0.png,企业版用户,2023-05-24 00:00:00,HUGE,,,,46
fb-approval-0330,建议入库,,teacher,老师库,老师,操作疑问,已处理,作业/布置/批改/反馈；题库/录题/单词书/模考,请问一下，系统自有题库里面的题目现在是要怎么布置呢，比如这个单题询证，是我们自有题库的题目，但是布置作业页面点击SAT以后不会出现这些题目,系统自有题库里面的题目现在是要怎么布置，搜索知识点没有出现相应题目,老师在布置作业页面，机构题库搜索试卷名称就可以看到并布置,老师在布置作业页面，机构题库搜索试卷名称就可以看到并布置,"9c3279e933f8b7184adfc73af201284.png,620ae77771ca1f6206369564f288f9e.png",企业版用户,2023-03-23 00:00:00,光禾,,,,46
fb-approval-0331,建议入库,,teacher,老师库,老师,操作疑问,已处理,作业/布置/批改/反馈；题库/录题/单词书/模考,机构题库里没有act题目,老师想布置act题目，在机构题库中没有找到,act在系统题库的模考测试里布置，机构题库是机构自己录入的内容,act在系统题库的模考测试里布置，机构题库是机构自己录入的内容,c0a208568a3c5d80f471dbfe9f6646d.png,企业版用户,2023-02-27 00:00:00,方隅,,,,46
fb-approval-0332,建议入库,,teacher,老师库,老师,使用问题,已处理,作业/布置/批改/反馈；题库/录题/单词书/模考,校校的老师好，我在系统机构自有题库里传了一些AP题目，其中有些配图。之前传的时候可以保存和预览，但这两天学生写作业发现图片都没了。刚才在系统后台尝试重新传图片，保存时候说出现错误,老师在自有题库录入ap题目1、录入的图片消失了 2、已完成的作业图片还在 3、重新上传显示保存失败,录入图片格式有误，后台已经把之前错误的格式都清除了，老师重新录入之后没问题,老师，您可以先确认作业是否已经成功布置、学生是否在对应班级内，以及作业状态是否已提交/已完成；如果状态正常但仍看不到，再提供学生账号和作业链接转人工排查。,5ca3b3ee37f9883be2698e849ca0742.jpg,企业版用户,2023-02-24 00:00:00,庭思,,,,46
fb-approval-0333,建议入库,,teacher,老师库,老师,使用问题,已处理,作业/布置/批改/反馈；题库/录题/单词书/模考,请问这个听抄和单词的颜色更新了，可以选择一些区别大的颜色吗？,,目前作业都是一种颜色，一共三种颜色区分作业、课程、模考,目前作业都是一种颜色，一共三种颜色区分作业、课程、模考,ad92bd4aecf739b091d330c90dd0e96.png,企业版用户,2023-02-10 00:00:00,洒脱,,,,46
fb-approval-0334,建议入库,,teacher,老师库,老师,使用问题,已处理,作业/布置/批改/反馈；题库/录题/单词书/模考,学生答对了，但系统判错,学生单词作业答对了，但是判错,单词书单词没有中文解释，可以在单词书添加下,老师，您可以先确认作业是否已经成功布置、学生是否在对应班级内，以及作业状态是否已提交/已完成；如果状态正常但仍看不到，再提供学生账号和作业链接转人工排查。,8556e39015cdf1b87ce04f936a84574.png,企业版用户,2024-03-26 00:00:00,新航道,,,,46
fb-approval-0335,建议入库,,teacher,老师库,老师,使用问题,已处理,作业/布置/批改/反馈；题库/录题/单词书/模考,学生单词测试出现相同的选项，有好几次了，这个怎么解决一下哇,学生单词作业有重复的选项,老师上传的单词书不童的单词上传的重复的释义,老师，您可以先确认作业是否已经成功布置、学生是否在对应班级内，以及作业状态是否已提交/已完成；如果状态正常但仍看不到，再提供学生账号和作业链接转人工排查。,6ad5702c22b55a05a0c2796de26d232.jpg,企业版用户,2024-06-29 00:00:00,爱英格知,,,,46
fb-approval-0336,建议入库,,teacher,老师库,老师,使用问题,已处理,作业/布置/批改/反馈；题库/录题/单词书/模考,请问这个听抄和单词的颜色更新了，可以选择一些区别大的颜色吗？,听抄和单词的颜色更新了，可以选择一些区别大的颜色吗,目前作业都是一种颜色，一共三种颜色区分作业、课程、模考,目前作业都是一种颜色，一共三种颜色区分作业、课程、模考,ad92bd4aecf739b091d330c90dd0e96.png,客户数据2月,2023-02-10 00:00:00,洒脱,,,,46
fb-approval-0337,建议入库,,teacher,老师库,老师,操作疑问,已处理,作业/布置/批改/反馈；题库/录题/单词书/模考,你好 如果我想布置全部33个单元的其中某几个单元的学习和检测，我勾选对应的Unit是不是就可以了？如果我不勾选，默认是布置的整本书吗？,布置单词书全部33个单元的其中某几个单元的学习和检测，是直接勾选对应的Unit吗？,布置就是布置一整本单词书 点击选择列表是布置抽查作业,布置就是布置一整本单词书 点击选择列表是布置抽查作业,eaa18ea498dc578b407fda23bcf08d0.png,客户数据5月,2023-05-24 00:00:00,HUGE,,,,46
fb-approval-0338,建议入库,,teacher,老师库,老师,使用问题,已处理,音频/录音/听力,听写内容是对的，校对结果显示错误,学生听写内容是对的，校对结果显示错误,听力原文显示的是正确答案，校对是告诉学生哪里有错误,听力原文显示的是正确答案，校对是告诉学生哪里有错误,e83c1a9551e8df9a6e940d93a66eb7c.jpg,企业版用户,2023-03-21 00:00:00,奕然雅思,,,,45
fb-approval-0339,建议入库,,teacher,老师库,老师,使用问题,已处理,音频/录音/听力,综合写作音频条旁边没有听力原文，辛苦技术看下哦,音频没有听力原文按钮,题干没有听力原文，只有材料音频才有听力原文,老师，您可以先让学生使用 Chrome 浏览器重新进入，并刷新页面或清理缓存。如果音频超过 15 秒仍未加载，可按页面提示下载音频本地播放；仍不行的话，再提供学生账号、测试链接和截图转人工排查。,87334808bbc56e800890cb97477bc96.png,企业版用户,2024-09-14 00:00:00,新航道济南,,,,45
fb-approval-0340,建议入库,,academic,教务库,教务,使用问题,已处理,浏览器/网络/缓存,课程名称有限制吗，我总打不上,课程名称无法填写,建议使用谷歌浏览器，对系统的适配性和兼容性更好,老师，这类情况通常和浏览器兼容性有关，建议学生优先使用 Chrome 浏览器重新进入；如果仍异常，再清理缓存、更换网络后重试。,99a400ee39c9f1ca6eadbd3ffc48fef.jpg,企业版用户,2023-08-04 00:00:00,throughout,,,,44
fb-approval-0341,建议入库,,academic,教务库,教务,使用问题,已处理,账号登录/密码/手机号,我们学员在系统中先后建了两个账号，一个账号，是非VIP，一个账号VIP，我们现在想把这两个账号变成一个账号，请问有什么办法呢？,学生有一个非VIP账号，又创建了一个VIP，想需要一个账号,可以将非VIP账号改为VIP账号，技术这边操作还原一个VIP账号,老师，题库类作业需要学生账号是 VIP 才能完成。如果学生不是 VIP，学生端可能看不到或无法进入作业，需要先确认学生账号权限。,,企业版用户,2023-04-18 00:00:00,洒脱,,,,44
fb-approval-0342,建议入库,,academic,教务库,教务,操作疑问,已处理,账号登录/密码/手机号,3个月账号到期后 如果要再给学生账号如何延续？,学生3个月账号到期后如何续期,续期操作流程： 1、教务/校长账号进入，点击学生管理 2、找到学生账号，点击学生列表中，学生姓名旁边的小圆点 3、点击“续期”即可。 续期一次即消耗一个学生账号，点击续期后，账号服务期从当日起计时,续期操作流程： 1、教务/校长账号进入，点击学生管理 2、找到学生账号，点击学生列表中，学生姓名旁边的小圆点 3、点击“续期”即可。 续期一次即消耗一个学生账号，点击续期后，账号服务期从当日起计时,,企业版用户,2023-04-15 00:00:00,思麦儿,,,,44
fb-approval-0343,建议入库,,academic,教务库,教务,操作疑问,已处理,账号登录/密码/手机号,你好 这个销售管理员的账号，点在添加下属，却不能添加销售，只有老师,销售管理员的账号添加下属不能添加销售，只能添加老师,销售和老师才可以添加下属，这个销售管理员还有老师的分身，所以下属可以选老师,销售和老师才可以添加下属，这个销售管理员还有老师的分身，所以下属可以选老师,,企业版用户,2023-04-11 00:00:00,爱英格知,,,,44
fb-approval-0344,建议入库,,academic,教务库,教务,操作疑问,已处理,账号登录/密码/手机号,请问下 如果学员账号过期了我想给他续3个月会员应该怎么操作呢？（找了一阵子没找到,学生账号到期应该怎么操作续期,续期操作流程： 1、教务/校长账号进入，点击学生管理 2、找到学生账号，点击学生列表中，学生姓名旁边的红色小圆点 3、点击“续期”即可。 续期一次即消耗一个学生账号，点击续期后，账号服务期从当日起计时,续期操作流程： 1、教务/校长账号进入，点击学生管理 2、找到学生账号，点击学生列表中，学生姓名旁边的红色小圆点 3、点击“续期”即可。 续期一次即消耗一个学生账号，点击续期后，账号服务期从当日起计时,,企业版用户,2023-04-08 00:00:00,光禾,,,,44
fb-approval-0345,建议入库,,academic,教务库,教务,操作疑问,已处理,账号登录/密码/手机号,老师您好，同一个号码怎么关联到2个学生？一个家长有两个孩子上课，录入系统显示电话号码已存在,家长有两个孩子，只有一个号码，如何录入系统,一个手机只能创建一个学生账号，需要更换手机号（可以是随意11位数字）,一个手机只能创建一个学生账号，需要更换手机号（可以是随意11位数字）,,企业版用户,2024-04-17 00:00:00,彬果,,,,44
fb-approval-0346,建议入库,,student,学生库,学生,使用问题,已处理,浏览器/网络/缓存,学生使用这个单词学习这个功能的时候啊，他进入这个单词，单词这一页之后，就停在这儿了，下边儿那个叫评测发音。那个按钮就一直转，他没有办法进入下一个单词,学生单词学习页面一致显示评测发音，不能进行下一步,学生用的微信直接打开，建议使用谷歌浏览器,老师，这类情况通常和浏览器兼容性有关，建议学生优先使用 Chrome 浏览器重新进入；如果仍异常，再清理缓存、更换网络后重试。,a864ef23eccdddecf326c94c5b2d550.jpg,企业版用户,2023-05-10 00:00:00,昊外,,,,44
fb-approval-0347,建议入库,,student,学生库,学生,使用问题,已处理,浏览器/网络/缓存,校校，学生反应说这个地方一直显示正在测评发音，并且读完第一个就没有后面了,,这个学生用的微信浏览器，需要使用正确的浏览器，pc电脑用谷歌，ipad的用safar,这个学生用的微信浏览器，需要使用正确的浏览器，pc电脑用谷歌，ipad的用safar,cc59f688f700637dfe450fd17379cf1.bmp,企业版用户,2023-02-04 00:00:00,曼哈顿,,,,44
fb-approval-0348,建议入库,,student,学生库,学生,使用问题,已处理,浏览器/网络/缓存,老师们 在背单词的时候就一直卡着 这个情况是学生直接退了重新进吗,浏览器使用错误导致一直在检测发音,建议学生电脑使用谷歌浏览器.ipad使用safari浏览器。谷歌浏览器下载地址 https://www.google.cn/intl/zh-CN/chrome/,老师，这类情况通常和浏览器兼容性有关，建议学生优先使用 Chrome 浏览器重新进入；如果仍异常，再清理缓存、更换网络后重试。,b70eaab7b6933d7b1b83fd412c7106d.jpg,企业版用户,2024-09-21 00:00:00,重庆新航道,,,,44
fb-approval-0349,建议入库,,student,学生库,学生,使用问题,已处理,浏览器/网络/缓存,校校，学生反应说这个地方一直显示正在测评发音，并且读完第一个就没有后面了,学生反应做题时一直显示正在测评发音,这个学生用的微信浏览器，需要使用正确的浏览器，pc电脑用谷歌，ipad的用safar,这个学生用的微信浏览器，需要使用正确的浏览器，pc电脑用谷歌，ipad的用safar,cc59f688f700637dfe450fd17379cf1.bmp,客户数据2月,2023-02-04 00:00:00,曼哈顿,,,,44
fb-approval-0350,建议入库,,student,学生库,学生,使用问题,已处理,浏览器/网络/缓存；题库/录题/单词书/模考,昨天给学生模考了一次托福的题，但是上面这些题学生都是对的，但是系统判定错误，麻烦看一下,学生答题选的对的，系统判错,学生答题使用的微软的Edge浏览器，在答题时可能会出现问题，建议使用谷歌浏览器答题,老师，这类情况通常和浏览器兼容性有关，建议学生优先使用 Chrome 浏览器重新进入；如果仍异常，再清理缓存、更换网络后重试。,e46b3ebcea1abe3a74385b603b15fe2.png,企业版用户,2023-08-15 00:00:00,领育,,,,44
fb-approval-0351,建议入库,,student,学生库,学生,操作疑问,已处理,浏览器/网络/缓存；题库/录题/单词书/模考,你好，学生模考界面卡住了，然后退出了，她的前面的做题记录还有吗,学生做入学模考退出了，前面的答题记录还有吗,学生可以退出重新接着做的，答题数据会同步，建议使用谷歌浏览器,老师，这类情况通常和浏览器兼容性有关，建议学生优先使用 Chrome 浏览器重新进入；如果仍异常，再清理缓存、更换网络后重试。,e291ebf5dccc004a17503ca875fb5d7.jpg,企业版用户,2023-03-18 00:00:00,Best学社,,,,44
fb-approval-0352,建议入库,,student,学生库,学生,使用问题,已处理,账号登录/密码/手机号,你好，学生账号张奕忱手机可以登录，电脑登不上去，是啥原因啦13060044956,学生登陆时显示账号或密码错误,学生可以选择忘记密码，也可以在学员管理里修改学生的登陆密码,学生可以选择忘记密码，也可以在学员管理里修改学生的登陆密码,,企业版用户,2023-04-11 00:00:00,爱英格知,,,,44
fb-approval-0353,建议入库,,student,学生库,学生,使用问题,已处理,账号登录/密码/手机号；小程序/公众号/二维码,您好，我们有个手机号登录不上小程序,学生无法登录小程序,学生登录密码错误，可以在系统忘记密码，重新设置密码，或者老师给学生修改,学生登录密码错误，可以在系统忘记密码，重新设置密码，或者老师给学生修改,,企业版用户,2023-05-23 00:00:00,睿途,,,,44
fb-approval-0354,建议入库,,teacher,老师库,老师,操作疑问,已处理,浏览器/网络/缓存,早上好! 请问系统自带的网络培训软件，只能在电脑端使用，是吗？有什么限制,直播课堂只能在电脑端使用吗，有什么限制,电脑和ipad都可以使用，人数在10人以内，结束时间到了就无法进入,电脑和ipad都可以使用，人数在10人以内，结束时间到了就无法进入,60e1db6e50092cf82ee933409c630ab.png,企业版用户,2023-03-29 00:00:00,英卓,,,,44
fb-approval-0355,建议入库,,teacher,老师库,老师,使用问题,已处理,浏览器/网络/缓存；小程序/公众号/二维码,学生篇章跟读显示语言上传失败,学生用手机自带浏览器做篇章跟读，显示语音上传失败,篇章跟读可以用手机小程序答题，用手机自带浏览器可能会不适配,篇章跟读可以用手机小程序答题，用手机自带浏览器可能会不适配,c4598fa5504d305eb531b1463669c53.jpg,企业版用户,2023-03-22 00:00:00,青澜,,,,44
fb-approval-0356,建议入库,,teacher,老师库,老师,操作疑问,已处理,账号登录/密码/手机号,请问过期学员如何续期,学生账号如何续期,续期操作流程： 1、教务/校长账号进入，点击学生管理 2、找到学生账号，点击学生列表中，学生姓名旁边的红色小圆点 3、点击“续期”即可。,续期操作流程： 1、教务/校长账号进入，点击学生管理 2、找到学生账号，点击学生列表中，学生姓名旁边的红色小圆点 3、点击“续期”即可。,,企业版用户,2024-02-29 00:00:00,菁仕,,,,44
fb-approval-0357,建议入库,,teacher,老师库,老师,使用问题,已处理,账号登录/密码/手机号,您好，请问学生账号过期登录不上的话，您们那边可以帮忙操作延期的吗？,学生账号过期登录不上，需要帮忙操作延期,校长管理员/教务端学员里找到学生，点击续期就可以,校长管理员/教务端学员里找到学生，点击续期就可以,,企业版用户,2023-09-24 00:00:00,海南北雅,,,,44
fb-approval-0358,建议入库,,teacher,老师库,老师,操作疑问,已处理,账号登录/密码/手机号,学生线上的账户登录不上，密码可以修改吗？,学生可以修改密码吗,可以在学员管理处修改，学生登录时也可以点击忘记密码进行重置,可以在学员管理处修改，学生登录时也可以点击忘记密码进行重置,,企业版用户,2023-06-27 00:00:00,一合,,,,44
fb-approval-0359,建议入库,,teacher,老师库,老师,使用问题,已处理,账号登录/密码/手机号,老师，我有个学生，换了一个手机号码，登录账号的时候用新号码登录不了，请问这个是如何处理呀？,更换了学生手机号码，登陆不了,修改手机号以后，如果没有修改密码，密码还是以前默认的号码后六位,修改手机号以后，如果没有修改密码，密码还是以前默认的号码后六位,,企业版用户,2023-05-31 00:00:00,孚外,,,,44
fb-approval-0360,建议入库,,teacher,老师库,老师,操作疑问,已处理,账号登录/密码/手机号,hi 这个系统怎么做笔记呀？如果老师想添加笔记呢？老师可以有学生账户嘛,老师可以做笔记吗,学生端口可以添加笔记，老师可以添加名师讲解。老师如果需要学生账号，可以给老师开一个公用的学生账号,学生端口可以添加笔记，老师可以添加名师讲解。老师如果需要学生账号，可以给老师开一个公用的学生账号,,企业版用户,2023-04-19 00:00:00,领冉,,,,44
fb-approval-0361,建议入库,,teacher,老师库,老师,操作疑问,已处理,账号登录/密码/手机号,老师端有没有能看到学员是不是VIP账号的地方,,在学员管理页面，VIP账号右上角是带V的，普通账户时没有V的,老师，题库类作业需要学生账号是 VIP 才能完成。如果学生不是 VIP，学生端可能看不到或无法进入作业，需要先确认学生账号权限。,,企业版用户,2023-02-27 00:00:00,方隅,,,,44
fb-approval-0362,建议入库,,teacher,老师库,老师,操作疑问,已处理,账号登录/密码/手机号,有学生账户最近快到期了，我把以前用过的学生停用了可以吗,把以前用过的学生账号停用了，会多出账号吗,账号开通后，点击停用只是学生那边无法登录，并不会多出一个账号名额,账号开通后，点击停用只是学生那边无法登录，并不会多出一个账号名额,,企业版用户,2023-02-25 00:00:00,源进,,,,44
