review_id,suggested_decision,human_decision,audience,audience_label,port,type,status,category,question,desc,original_answer,suggested_answer,attachment,source_sheet,date,customer,manager,owner,review_note,score
fb-approval-0693,建议入库,,principal,校长库,校长,操作疑问,已处理,班级/排课/课时/考勤,一个学生有三个科目 这个课表不能合并了吗,学生有三个班级，不能直接看到全部的课表吗,可以点击课表，勾选学生的所有班级，就可以看到一起的课表了,老师，您可以先检查班级课时、学生所在班级和转入班级配置是否完整；如果提示无剩余课时，通常需要先确认目标班级是否设置了总课时。,,企业版用户,2023-03-09 00:00:00,思潮,,,,32
fb-approval-0694,建议入库,,sales,销售库,销售,操作疑问,已处理,班级/排课/课时/考勤,已经是正式学员的，申请另一科的试听，怎么操作？,已转正的学生如何排试听课,试听课目前只有潜客可以预约，正式学员教务可以直接把学生加入需要试听的班级，排赠送课程，不计算课消,试听课目前只有潜客可以预约，正式学员教务可以直接把学生加入需要试听的班级，排赠送课程，不计算课消,,企业版用户,2024-03-26 00:00:00,新洲际,,,,32
fb-approval-0695,建议入库,,sales,销售库,销售,操作疑问,已处理,班级/排课/课时/考勤,老师，学生之前试听过了，现在校校操作重新试听，怎么操作？,如何再次安排学生试听,试听课目前只有潜客可以预约，潜客可以再生成一条线索试听，如果潜客是跟进中（已预约，已试听等）的状态，还未签约，就可以直接选择其他需要试听的课程，教务这边会收到排课提醒 正式学员教务可以直接把学生加入需要试听的班级，排赠送课程，不计算课消,试听课目前只有潜客可以预约，潜客可以再生成一条线索试听，如果潜客是跟进中（已预约，已试听等）的状态，还未签约，就可以直接选择其他需要试听的课程，教务这边会收到排课提醒 正式学员教务可以直接把学生加入需要试听的班级，排赠送课程，不计算课消,,企业版用户,2024-04-17 00:00:00,新洲际,,,,32
fb-approval-0696,建议入库,,sales,销售库,销售,操作疑问,已处理,班级/排课/课时/考勤,老师 学生班课转一对一 怎么操作开课申请,学生班课转一对一 怎么操作,需要教务老师创建一个一对一班级 把学生从之前班课班级移除后 拉入一对一班级,需要教务老师创建一个一对一班级 把学生从之前班课班级移除后 拉入一对一班级,,企业版用户,2024-05-10 00:00:00,新洲际,,,,32
fb-approval-0697,建议入库,,sales,销售库,销售,操作疑问,已处理,班级/排课/课时/考勤,老师您好，学生试听，要试听两科，怎么操作啊,如何操作学生试听两个科目,销售端潜客页面沟通进度改成已预约，填写相关预约课程，点击保存，教务端会有试听排课信息，需要排另外的课程，就修改课程在保存一遍，教务端会收到新的试听申请,销售端潜客页面沟通进度改成已预约，填写相关预约课程，点击保存，教务端会有试听排课信息，需要排另外的课程，就修改课程在保存一遍，教务端会收到新的试听申请,,企业版用户,2024-08-20 00:00:00,创英睿,,,,32
fb-approval-0698,建议入库,,sales,销售库,销售,操作疑问,已处理,班级/排课/课时/考勤；小程序/公众号/二维码,我的意思是 一个新生，未报名的学生，可以看到课表吗？,未报名的学生，怎么可以看到课表,正式学员入班级才能看到课表。如果是潜客，未报名的状态，可以把班级上架到报名小程序上，潜客可以在报名小程序上看到班级排课,正式学员入班级才能看到课表。如果是潜客，未报名的状态，可以把班级上架到报名小程序上，潜客可以在报名小程序上看到班级排课,,企业版用户,2023-05-05 00:00:00,睿途,,,,32
fb-approval-0699,建议入库,,sales,销售库,销售,使用问题,已处理,权限/角色/公池,还有一个客户提交后我的客户名单里居然查不到了,潜客录入之后没有显示,先后提交了两次，第一次录入到公池的 - 成功，第二次提交到自己的线索池 - 失败， 他应该是先录入到了公池然后取自己的线索池看，没有,先后提交了两次，第一次录入到公池的 - 成功，第二次提交到自己的线索池 - 失败， 他应该是先录入到了公池然后取自己的线索池看，没有,,企业版用户,2024-02-18 00:00:00,新洲际,,,,31
fb-approval-0700,建议入库,,sales,销售库,市场,操作疑问,已处理,权限/角色/公池,你好，市场端口录入资源没法选择销售，这个可以增加一栏选择负责销售吗,市场端口录入资源没法选择销售,可以给市场一个潜客分配的权限，可以分配给销售,可以给市场一个潜客分配的权限，可以分配给销售,,企业版用户,2024-01-10 00:00:00,爱英格知,,,,31
fb-approval-0701,建议入库,,sales,销售库,销售,操作疑问,已处理,权限/角色/公池,销售选择已结案的客户后 他自己就找不到这个客户了，但在我这边的销售主管端口是可以找到的 这个是为什么？,销售把跟进状态改为已结案，就找不到这个客户了,已结案代表这个学生后面不会再去跟进了，所以会放到公池中,已结案代表这个学生后面不会再去跟进了，所以会放到公池中,,企业版用户,2023-03-30 00:00:00,米高,,,,31
fb-approval-0702,建议入库,,sales,销售库,销售,操作疑问,已处理,权限/角色/公池；题库/录题/单词书/模考,请问这个测试的推荐人是由谁来添加呀那学生在没选推荐人的情况下写完了测试，哪里能看到测试结果呢,入学测试的推荐人如何添加,推荐人是有销售身份的员工。需要校长，管理员，有员工管理权限的教务可以添加，校长和销售管理员可以在公池查看,推荐人是有销售身份的员工。需要校长，管理员，有员工管理权限的教务可以添加，校长和销售管理员可以在公池查看,,企业版用户,2023-10-26 00:00:00,超级学长,,,,31
fb-approval-0703,建议入库,,sales,销售库,销售,使用问题,已处理,权限/角色/公池；题库/录题/单词书/模考,最近出现了好几个孩子都是这种情况，分配测试的顾问看不到孩子的数据,分配测试的顾问在公池看不到孩子的入学模考数据,复制的某一套题的链接给学生答题如果是从教务身份复制的链接，在公池里就查不到，需要销售身份复制链接才可以,老师，这个一般和账号角色或权限有关。您可以先确认当前账号是否有对应功能权限；如果需要让其他角色查看，需要在权限配置里开通对应模块。,,企业版用户,2023-06-10 00:00:00,睿途,,,,31
fb-approval-0704,建议入库,,sales,销售库,销售,使用问题,已处理,权限/角色/公池；题库/录题/单词书/模考,请教一个系统问题：学生第一次用潜客身份做的模考测试我看得到的，但是第二次继续从主页面右上角做入学模考测试（不同套），但是现在看不到，学生确认提交的，请问是否有解决方案噢～,学生做第二套入学模考，销售无法查看,在公池里搜索学生号码，点击入学模考就可以看到了,在公池里搜索学生号码，点击入学模考就可以看到了,,企业版用户,2023-04-15 00:00:00,YES,,,,31
fb-approval-0705,建议入库,,principal,校长库,校长,操作疑问,已处理,账号登录/密码/手机号,过期的账户，怎么 续用？,账号如何续期,在学员管理，点击学生账号选择续期,在学员管理，点击学生账号选择续期,,企业版用户,2023-03-05 00:00:00,寸心,,,,30
fb-approval-0706,建议入库,,principal,校长库,校长,操作疑问,已处理,账号登录/密码/手机号,麻烦问一下，学生的系统账号到期了，想给他续上，怎么操作呢，就是3个月到期了，但是学生课程又延长了,学生的系统账号到期了，如何操作续期,教务/校长端在学员管理点击续期,教务/校长端在学员管理点击续期,,企业版用户,2024-04-09 00:00:00,唯优,,,,30
fb-approval-0707,建议入库,,sales,销售库,销售,使用问题,已处理,账号登录/密码/手机号；题库/录题/单词书/模考,帮我找个学生的测试，他随便选了一个老师，侯佳仑,学生入学模考找不到，校长账号也找不到,学生作答的域名是上海澜大教育,学生作答的域名是上海澜大教育,,企业版用户,2023-07-11 00:00:00,澜大,,,,30
fb-approval-0708,建议入库,,sales,销售库,销售,使用问题,已处理,账号登录/密码/手机号；题库/录题/单词书/模考,这个怎么弄，新学生测试登录不进去,新学生测试登录不进去，显示手机号未注册,需要进入入学模考页面，不是在登录页面,需要进入入学模考页面，不是在登录页面,,企业版用户,2023-05-05 00:00:00,小猴取经,,,,30
fb-approval-0709,建议入库,,principal,校长库,校长,操作疑问,已处理,作业/布置/批改/反馈,请问我们教材/助教主管老师可以如何总览查看老师们的反馈吗？就是看哪些课程还没有发反馈,如何查看老师的反馈数据,数据——老师分析——查看详情可以查看,数据——老师分析——查看详情可以查看,,企业版用户,2023-12-24 00:00:00,芝青藤,,,,29
fb-approval-0710,建议入库,,sales,销售库,销售,使用问题,已处理,班级/排课/课时/考勤,老师好，这个板块目前无法出现所有的班级，请问怎么解决呀,潜客报名，课程下班级显示不全,班级类型没有选择或者不是一对多,老师，您可以先检查班级课时、学生所在班级和转入班级配置是否完整；如果提示无剩余课时，通常需要先确认目标班级是否设置了总课时。,802f58732133796cd7d61f4058d1c38.png,企业版用户,2023-12-14 00:00:00,庭思,,,,29
fb-approval-0711,建议入库,,principal,校长库,校长,使用问题,已处理,权限/角色/公池；题库/录题/单词书/模考,请问一下，学生做完了测试，但是我这边后台看不到怎么办,学生做完了入学模考，公池看不到,学生名字不对应，可以通过入学模考查询,老师，这个一般和账号角色或权限有关。您可以先确认当前账号是否有对应功能权限；如果需要让其他角色查看，需要在权限配置里开通对应模块。,"fc0ae0b8b3517a7a1f5e9fc17e5dd09.png,8e299c769654a0d0c999a6e441592b3.jpg",企业版用户,2023-09-21 00:00:00,本心,,,,28
fb-approval-0712,建议入库,,sales,销售库,销售,操作疑问,已处理,权限/角色/公池,请问标注已结案的跑去哪里了呢,学生状态修改为已结案的学生在哪里看,已结案的学生在公池里可以看到,已结案的学生在公池里可以看到,b51c9fdcd259781f80026d2ca201010.png,企业版用户,2023-03-23 00:00:00,英卓,,,,28
fb-approval-0713,建议入库,,sales,销售库,销售,操作疑问,已处理,权限/角色/公池；题库/录题/单词书/模考,完成测试，用的海思阁的网址，但是还是没有检测报告,学生完成了入学测试，销售找不到,没有给销售查看入学模考的权限,没有给销售查看入学模考的权限,ef18b5b23a6c7350d04a41c2e85fc86.jpg,企业版用户,2023-06-17 00:00:00,highscore,,,,28
fb-approval-0714,建议入库,,sales,销售库,销售,使用问题,已处理,权限/角色/公池；题库/录题/单词书/模考,学生做过模考之后，就多了一条学生信息。原来录入的记录点开来就显示不出来了,录入的学生沟通记录看不到,老师没有点击沟通记录，看的是变更记录,老师没有点击沟通记录，看的是变更记录,"095ca55fccb05cd6a167546bdcc0a59.png,2cf75e9a15587da6a3a54728a2aa924a.mp4",企业版用户,2023-03-12 00:00:00,七嘉,,,,28
fb-approval-0715,建议入库,,sales,销售库,销售,使用问题,已处理,权限/角色/公池；题库/录题/单词书/模考,老师，您好，学生做入学测试的时候，选了推荐老师，但是推荐老师后台看不到学生入学莫测成绩，孩子有一科没有做，写作没写，跟这个有关系吗,销售端查看不了学生的入学测试,销售身份没有查看入学模考的权限,销售身份没有查看入学模考的权限,50fd038890228727b6761886ec3e5c1.png,企业版用户,2024-09-03 00:00:00,津桥,,,,28
fb-approval-0716,建议入库,,principal,校长库,校长,操作疑问,已处理,权限/角色/公池,各位老师们，我想问下 就是校长的系统里学员管理怎么把反复在多个班的学生合并掉啊。。只看有哪几个学员，就像我有一个学员她在3个班待过就有三条信息,如何筛选在读学员数量,在校长端公池里筛选出所有正式学员,在校长端公池里筛选出所有正式学员,,企业版用户,2023-09-23 00:00:00,极意,,,,25
fb-approval-0717,建议入库,,principal,校长库,校长,使用问题,已处理,权限/角色/公池；题库/录题/单词书/模考,我们刚做了一个托福的测试，但是后台没有找到测试数据,学生做了入学模考，没有查到数据,老师i在公池里查找时，没有点击全部,老师i在公池里查找时，没有点击全部,,企业版用户,2023-04-03 00:00:00,北雅,,,,25
fb-approval-0718,建议入库,,principal,校长库,校长,操作疑问,已处理,权限/角色/公池；题库/录题/单词书/模考,学生已经做完 入学测试，也选了销售名字，但是，系统内，并没有出现 入学测试的结果,,没有给销售看入学模考的权限,没有给销售看入学模考的权限,,企业版用户,2023-02-15 00:00:00,寸心,,,,25
fb-approval-0719,建议入库,,principal,校长库,校长,操作疑问,已处理,权限/角色/公池；题库/录题/单词书/模考,学生已经做完 入学测试，也选了销售名字，但是，系统内，并没有出现 入学测试的结果,学生已经做完入学测试，销售不能查到,没有给销售看入学模考的权限,没有给销售看入学模考的权限,,客户数据2月,2023-02-15 00:00:00,寸心,,,,25
fb-approval-0720,建议入库,,sales,销售库,销售,操作疑问,已处理,权限/角色/公池,老师 这个界面我们备注学生情况会写在沟通内容那里 但是教务那边是看不到的 怎么给教务老师开这个权限呢,教务如何看到潜客沟通内容,可以给教务“公池”的权限,可以给教务“公池”的权限,,企业版用户,2024-03-19 00:00:00,新洲际,,,,25
fb-approval-0721,建议入库,,sales,销售库,销售,使用问题,已处理,权限/角色/公池,需要修改学生的电话号码，已经成单了的，我应该怎么操作？,修改不了学生号码，显示灰色,帐号没有潜客联系方式来源修改的权限,帐号没有潜客联系方式来源修改的权限,,企业版用户,2023-08-01 00:00:00,爱英格知,,,,25
fb-approval-0722,建议入库,,sales,销售库,销售,操作疑问,已处理,权限/角色/公池,老师，为什么协同销售看不到学生的入学模测呢？,协同销售看不到学生的入学模测,协作销售需要在潜客列表查看,协作销售需要在潜客列表查看,,企业版用户,2023-07-06 00:00:00,领世贵学,,,,25
fb-approval-0723,建议入库,,sales,销售库,销售,使用问题,已处理,权限/角色/公池；题库/录题/单词书/模考,谢谢！我之前有些学生模考分数后台是不是给我删了，找不到了，系统里没了,老师之前负责的潜客在系统里找不到数据,潜客都未跟进掉入了公池，需要重新分配,潜客都未跟进掉入了公池，需要重新分配,,企业版用户,2023-07-05 00:00:00,澜大,,,,25
fb-approval-0724,建议入库,,sales,销售库,销售,操作疑问,已处理,权限/角色/公池；题库/录题/单词书/模考,学生陈乐天在陈安琪老师的销售系统里，但是看不到学生的入学测试，但是可以在总系统公池可以看到，好像是因为第一次测试没有选择陈老师的原因，像这种情况有什么办法可以合并过去吗？,销售看不到学生的入学模考,没有给销售查看入学模考的权限,没有给销售查看入学模考的权限,,企业版用户,2023-04-16 00:00:00,环雅,,,,25
fb-approval-0725,建议入库,,teacher,老师库,老师,使用问题,已处理,账号登录/密码/手机号；班级/排课/课时/考勤；订单/合同/报课/收费,老师 你好，在系统里我已经完成录入，学员里面已显示，但是班级里面不显示 现在无法安排对应老师,创建了学生账号，没有自动生成班级,只有在创建订单的时候选择一对一班级才会自动生成班级，如果不创建订单，班级就需要创建,老师，您可以先检查班级课时、学生所在班级和转入班级配置是否完整；如果提示无剩余课时，通常需要先确认目标班级是否设置了总课时。,"db75f42071b7f2d4ef0b1662f3aac4e.png,d2ae57f45165bbe2b62854f7bf5a85b.png",企业版用户,2024-04-16 00:00:00,美傲弗,,,,23
fb-approval-0726,建议入库,,academic,教务库,教务,操作疑问,已处理,账号登录/密码/手机号；班级/排课/课时/考勤；订单/合同/报课/收费,老师 请问怎么录入学生进班级呢,如何录入学生进班级,1：教务/校长端创建学员账号，创建班级，加入学生2：销售端创建潜客，通过报课的形式创建订单，订单可以选择教务已创建的班级，或者系统自动生成一对一班级，然后将学生转为正式学员，自动进,老师，您可以先检查班级课时、学生所在班级和转入班级配置是否完整；如果提示无剩余课时，通常需要先确认目标班级是否设置了总课时。,,企业版用户,2024-06-12 00:00:00,新航道,,,,20
fb-approval-0727,建议入库,,academic,教务库,教务,使用问题,已处理,小程序/公众号/二维码,为什么有的有家长二维码有的没有.这个家长电话也填写了，就是没有家长二维码这个对话框,填写了家长号码，但是没有家长二维码显示,这个学生没有填写家长号码，只填写了家长姓名,这个学生没有填写家长号码，只填写了家长姓名,"7538908063c8a587e33e79412d3779e.png,00f6edc7cd220be8963c6e85a5fa437.png",企业版用户,2023-12-23 00:00:00,方隅,,,,17
fb-approval-0728,建议入库,,student,学生库,学生,操作疑问,已处理,,学生反映数学题经常没有办法提交，会卡在当前页面。烦请查看一下,学生ipad做sat，没有下一题按钮,因为部分ipad屏幕会有兼容问题，可以让学生试下将答题页面放大再下拉屏幕，就可以看到next按钮,因为部分ipad屏幕会有兼容问题，可以让学生试下将答题页面放大再下拉屏幕，就可以看到next按钮,0996b67fe432d365b67a53c10e64dca.jpg,企业版用户,2023-09-04 00:00:00,微果,,,,17
fb-approval-0729,建议入库,,student,学生库,学生,使用问题,已处理,,首先 学生账户可否在完成提交后 自己也能看到这个界面，目前学生就是题目做完提交后 即不知道自己错的地方正确答案是什么 也没发再去整理积累这些错的地方,逐句听写，学生是否可以看到结果页，如何整理错题,学生也可以在错题页面查看自己练习的错题详情,学生也可以在错题页面查看自己练习的错题详情,5d0febc4a389b0202cc093c05b0fc41.jpg,企业版用户,2023-08-02 00:00:00,悠学辉,,,,17
fb-approval-0730,建议入库,,student,学生库,学生,使用问题,已处理,,咱们自适应的技术问题是在这里问是吧,学生自适应练习没有更新，不能做第六天练习,学生这边设置的考试日期已过，可以把考试日期往后调整一下,学生这边设置的考试日期已过，可以把考试日期往后调整一下,a09deed7e16b314945f39bfb524db80.jpg,企业版用户,2023-05-13 00:00:00,奕然雅思,,,,17
fb-approval-0731,建议入库,,student,学生库,学生,使用问题,已处理,,老师您好~学生反映系统里阅读题每篇的第九题都无法选择答案，这是什么原因呢？,学生做阅读题时第九题插入题选不上,学生答题录屏显示，学生第一篇第九题没有点上，第二篇第九题跳过了,学生答题录屏显示，学生第一篇第九题没有点上，第二篇第九题跳过了,"368256818a8ddedf63ffd17db9c2c40.png,fc8baf1f0ae5ccdaea68aa2b47e4597.png",企业版用户,2023-03-07 00:00:00,向山国际,,,,17
fb-approval-0732,建议入库,,student,学生库,学生,使用问题,已处理,,在系统上做托福阅读为什么会出现这种情况？我明明做题时选了个答案，它又不给我算进去,学生做托福阅读时，学生说选上了但是系统没显示,看学生答题录屏，可以看到学生这一题没有选,看学生答题录屏，可以看到学生这一题没有选,image.png,企业版用户,2023-02-25 00:00:00,洒脱,,,,17
fb-approval-0733,建议入库,,student,学生库,学生,使用问题,已处理,,学生反应做题时有问题，有的说系统选不上，有的说自己选的和结果出来的不对应,,看录屏学生都是选上了的，没选上有可能是学生没有点击答案，不对应可能是不小心点错了或者修改过忘了,看录屏学生都是选上了的，没选上有可能是学生没有点击答案，不对应可能是不小心点错了或者修改过忘了,b7b21ab3382a344937baf74e59cfdc6.png,企业版用户,2023-02-25 00:00:00,江博教育,,,,17
fb-approval-0734,建议入库,,student,学生库,学生,使用问题,已处理,,学生反应做题时有问题，有的说系统选不上，有的说自己选的和结果出来的不对应,学生反应做题时有问题，有的说系统选不上，有的说自己选的和结果出来的不对应,看录屏学生都是选上了的，没选上有可能是学生没有点击答案，不对应可能是不小心点错了或者修改过忘了,看录屏学生都是选上了的，没选上有可能是学生没有点击答案，不对应可能是不小心点错了或者修改过忘了,b7b21ab3382a344937baf74e59cfdc6.png,客户数据2月,2023-02-25 00:00:00,江博教育,,,,17
fb-approval-0735,建议入库,,student,学生库,学生,使用问题,已处理,小程序/公众号/二维码,"你好，请问我们校方的后台可以帮忙解绑的吗,还是一定要绑定的本人",学生绑定公众号显示已绑定其他微信,如果不记得之前是谁绑定的话，技术这边可以处理,如果不记得之前是谁绑定的话，技术这边可以处理,9842a25799d644a8b5652f502f60a64.jpg,企业版用户,2023-03-29 00:00:00,问鼎,,,,17
fb-approval-0736,建议入库,,student,学生库,学生,使用问题,已处理,题库/录题/单词书/模考,还有个问题 学生词汇测试 选项基本就三个,学生听音选择选项有空的,单词书的词表里有些单词的中文解释是没有的，所以听音选择里选项抓取到了空的,单词书的词表里有些单词的中文解释是没有的，所以听音选择里选项抓取到了空的,5659da81b4396b870f31451b66080bb.jpg,企业版用户,2023-09-10 00:00:00,独角兽,,,,17
fb-approval-0737,建议入库,,student,学生库,学生,使用问题,已处理,题库/录题/单词书/模考,学生做雅思入学模考B卷36题模考题目突然缺失,学生做雅思入学模考B卷36题模考题目突然缺失,答题录屏显示：36题是有显示的，但是学生在进行highlight操作时，框到了答题框，所以影响了答题,答题录屏显示：36题是有显示的，但是学生在进行highlight操作时，框到了答题框，所以影响了答题,8858f4ca409802eff1325bf94767522.png,企业版用户,2023-03-22 00:00:00,南瓜藤,,,,17
fb-approval-0738,建议入库,,teacher,老师库,老师,使用问题,已处理,,为什么这里显示不了成绩呀？,学生结果页没有显示成绩,审核成绩后发布，需要老师发布成绩，学生才能看到,审核成绩后发布，需要老师发布成绩，学生才能看到,a76de8f1b9f224ca819c566abb11c44.jpg,企业版用户,2023-07-22 00:00:00,MHT,,,,17
fb-approval-0739,建议入库,,teacher,老师库,老师,操作疑问,已处理,,查询每个顾问指定时间内分配的数量，怎么操作呢,,在统计分析的销售统计里，筛选时间，查看新增潜客,在统计分析的销售统计里，筛选时间，查看新增潜客,image.png,企业版用户,2023-02-28 00:00:00,泛意,,,,17
fb-approval-0740,建议入库,,teacher,老师库,老师,使用问题,已处理,,我们老师给口语里每个task都打了分，但是口语部分的总分还是显示0分,,如果老师之前，给整个口语改过分数的，那么再去改单道口语的分数，整个口语的分数就不会变 0分可能是老师鼠标不小心点到过，所以系统判定已修改,如果老师之前，给整个口语改过分数的，那么再去改单道口语的分数，整个口语的分数就不会变 0分可能是老师鼠标不小心点到过，所以系统判定已修改,"aa40461eb691b436992cad12c4c5f1a.png,0ec4dfc5cd3aa3d4eb19ba6935fd5c9.jpg",企业版用户,2023-02-24 00:00:00,光禾,,,,17
