review_id,suggested_decision,human_decision,audience,audience_label,port,type,status,category,question,desc,original_answer,suggested_answer,attachment,source_sheet,date,customer,manager,owner,review_note,score
fb-approval-1070,改写后入库,,teacher,老师库,老师,操作疑问,已处理,作业/布置/批改/反馈；题库/录题/单词书/模考,问我们校校系统可以把10个视频传到后台，生成一个链接给学生们学习嘛？,,可以的，有两种布置方式： 1、仅布置视频。布置作业——选择课件作业——多选视频课件后——添加学习名称——发布，完成布置 2、视频+练习。正常布置作业的方式（模考作业）——关联音视频，点击关联，选择视频内容，点击完成。——选择练习内容并添加——保存/布置，完成布置。,可以的，有两种布置方式： 1、仅布置视频。布置作业——选择课件作业——多选视频课件后——添加学习名称——发布，完成布置 2、视频+练习。正常布置作业的方式（模考作业）——关联音视频，点击关联，选择视频内容，点击完成。——选择练习内容并添加——保存/布置，完成布置。,,企业版用户,2023-02-20 00:00:00,南京学了么,,,,43
fb-approval-1071,改写后入库,,teacher,老师库,老师,操作疑问,已处理,作业/布置/批改/反馈；题库/录题/单词书/模考,问我们校校系统可以把10个视频传到后台，生成一个链接给学生们学习嘛？,系统可以把10个视频传到后台，生成一个链接给学生们学习吗,可以的，有两种布置方式： 1、仅布置视频。布置作业——选择课件作业——多选视频课件后——添加学习名称——发布，完成布置 2、视频+练习。正常布置作业的方式（模考作业）——关联音视频，点击关联，选择视频内容，点击完成。——选择练习内容并添加——保存/布置，完成布置。,可以的，有两种布置方式： 1、仅布置视频。布置作业——选择课件作业——多选视频课件后——添加学习名称——发布，完成布置 2、视频+练习。正常布置作业的方式（模考作业）——关联音视频，点击关联，选择视频内容，点击完成。——选择练习内容并添加——保存/布置，完成布置。,,客户数据2月,2023-02-20 00:00:00,南京学了么,,,,43
fb-approval-1072,改写后入库,,teacher,老师库,老师,使用问题,已处理,音频/录音/听力,tpo74这道题目学生在做听力时系统跳掉了一篇对话一篇讲座，请问能否帮忙看看是么原因？谢谢,tpo74这道题目学生在做听力时系统跳掉了一篇对话一篇讲座,录屏显示学生这部分的答题时间到了，所以自动结束了,老师，您可以先让学生使用 Chrome 浏览器重新进入，并刷新页面或清理缓存。如果音频超过 15 秒仍未加载，可按页面提示下载音频本地播放；仍不行的话，再提供学生账号、测试链接和截图转人工排查。,,企业版用户,2023-04-15 00:00:00,光禾,,,,42
fb-approval-1073,改写后入库,,academic,教务库,教务,使用问题,已处理,账号登录/密码/手机号,您好 这个我刚刚不小心续签了一年 怎么给她取消呢,误操作续了一个学生账号，需要还原,技术已处理,技术已处理,image.png,企业版用户,2023-03-23 00:00:00,思潮,,,,41
fb-approval-1074,改写后入库,,academic,教务库,教务,操作疑问,已处理,账号登录/密码/手机号,您好，帮忙看下，这个是我们一个老师的账号，显示停用了,员工账号停用了如何操作,教务端员工管理里面启用下,教务端员工管理里面启用下,d3b0a36c02859466dd6e49636db199c.png,客户数据8月,2023-08-30 00:00:00,海南北雅,,,,41
fb-approval-1075,改写后入库,,student,学生库,学生,使用问题,已处理,账号登录/密码/手机号,和上次一样，又有学生报错,学生无法登录系统,网址输入有误,网址输入有误,ca3dc8dec84d14532618695831396f3.jpg,企业版用户,2024-01-28 00:00:00,问鼎,,,,41
fb-approval-1076,改写后入库,,student,学生库,学生,使用问题,已处理,账号登录/密码/手机号,老师好 学生之前一直用自己的账号都是ok的 今天突然登录的时候跳转出需要验证码 麻烦老师帮忙看看是什么情况哦,学生无法登陆系统,学生点击的忘记密码,学生点击的忘记密码,73c73f00f20cc0fa9247cee29693548.jpg,企业版用户,2024-05-13 00:00:00,澜大,,,,41
fb-approval-1077,改写后入库,,student,学生库,学生,使用问题,已处理,账号登录/密码/手机号；小程序/公众号/二维码,校校老师好，学生登录校校网页后，扫描二维码之后，网页版还是进不去，请问怎么解决？谢谢,学生在pc端登陆成了家长账号，显示需要扫描二维码,学生应登录学生账号,学生应登录学生账号,064f74360fb3ccfe48c973088ede857.jpg,企业版用户,2023-03-04 00:00:00,方隅,,,,41
fb-approval-1078,改写后入库,,student,学生库,学生,使用问题,已处理,账号登录/密码/手机号；题库/录题/单词书/模考,您好，请帮忙看一下，胥晴同学的账号为什么无法进入题库作答,学生无法进入雅思答题,雅思新页面,雅思新页面,762e4c96fc41ed8d6f0f18601dc6223.png,企业版用户,2024-04-17 00:00:00,诺得,,,,41
fb-approval-1079,改写后入库,,teacher,老师库,老师,使用问题,已处理,账号登录/密码/手机号,and 现在这个是什么情况呀这个是我们自己编的一个手机号占位用的为什么会报错,输入手机号报错,号码后面有空格,号码后面有空格,1a1e576da44cfa560f985bef1e8ec45.png,企业版用户,2023-12-25 00:00:00,悠学辉,,,,41
fb-approval-1080,改写后入库,,teacher,老师库,老师,操作疑问,已处理,账号登录/密码/手机号,您好，帮忙看下，这个是我们一个老师的账号，显示停用了,员工账号停用了如何操作,教务端员工管理里面启用下,教务端员工管理里面启用下,d3b0a36c02859466dd6e49636db199c.png,企业版用户,2023-08-30 00:00:00,海南北雅,,,,41
fb-approval-1081,改写后入库,,teacher,老师库,老师,使用问题,已处理,账号登录/密码/手机号,您好，学生账号还没有到截止日期，但是端口无法登陆,学生账号无法登录,网址错误,网址错误,b91312d59ed2afb1002cbd0d44376d81.mp4,企业版用户,2024-07-01 00:00:00,啼分鸡,,,,41
fb-approval-1082,改写后入库,,teacher,老师库,老师,使用问题,已处理,账号登录/密码/手机号,密码不对呢网址就是我把我的网址复制给了学生呢一直说学生手机号没注册,学生登录不了系统,学生账号未注册,学生账号未注册,76313be35a05b2555c032c6e004cee8.jpg,企业版用户,2024-08-28 00:00:00,新航道,,,,41
fb-approval-1083,改写后入库,,teacher,老师库,老师,使用问题,已处理,账号登录/密码/手机号；小程序/公众号/二维码,我用电脑登录网站想绑定小程序，显示该手机号未注册怎么办，谢谢解答,老师登录系统显示手机号未注册,没有使用正确的网址,没有使用正确的网址,67cbc469e1cd30b1f4e780caa39c072.jpg,企业版用户,2023-03-30 00:00:00,best,,,,41
fb-approval-1084,改写后入库,,teacher,老师库,老师,操作疑问,已处理,账号登录/密码/手机号；小程序/公众号/二维码,为什么我的微信绑定账号完全换成了另一个人呢,扫描微信二维码进入小程序是系统测试账号,应直接扫小程序二维码,应直接扫小程序二维码,"f11e967d4de52358870d4660a14e22f.jpg,dbfc26474b5ce84417c140571da67be.jpg",企业版用户,2023-02-14 00:00:00,来好思,,,,41
fb-approval-1085,改写后入库,,teacher,老师库,老师,操作疑问,已处理,账号登录/密码/手机号；小程序/公众号/二维码,扫了这个二维码关注公众号，是这个界面,关注公众号之后绑定小程序是测试账号,应直接扫描小程序二维码,应直接扫描小程序二维码,c17a0c1184adb69ba5219ccf4b9d165.jpg,企业版用户,2023-02-07 00:00:00,朴拓,,,,41
fb-approval-1086,改写后入库,,teacher,老师库,老师,操作疑问,已处理,账号登录/密码/手机号；小程序/公众号/二维码,我们老师关注了小程序后，为什么不是她的账号页面,,应直接扫小程序码,应直接扫小程序码,72c967e6a9fc20795957c2a31f5ab15.jpg,企业版用户,2023-02-06 00:00:00,朴拓,,,,41
fb-approval-1087,改写后入库,,teacher,老师库,老师,操作疑问,已处理,账号登录/密码/手机号；小程序/公众号/二维码,扫了这个二维码关注公众号，是这个界面,老师关注公众号之后绑定小程序是测试账号,应直接扫描小程序二维码,应直接扫描小程序二维码,c17a0c1184adb69ba5219ccf4b9d165.jpg,客户数据2月,2023-02-07 00:00:00,朴拓,,,,41
fb-approval-1088,改写后入库,,teacher,老师库,老师,操作疑问,已处理,账号登录/密码/手机号；题库/录题/单词书/模考,正在模考托福，但是学生这个声音识别不了，是否可以用我的电脑登陆账号继续考试？,,可以退出再继续答题,可以退出再继续答题,173e78560f8be76dae9cfe3412990db.jpg,企业版用户,2023-02-18 00:00:00,北外,,,,41
fb-approval-1089,改写后入库,,teacher,老师库,老师,操作疑问,已处理,账号登录/密码/手机号；题库/录题/单词书/模考,正在模考托福，但是学生这个声音识别不了，是否可以用我的电脑登陆账号继续考试？,学生做模考托福时声音识别不了，是否可以更换设备继续考试,可以退出再继续答题,可以退出再继续答题,173e78560f8be76dae9cfe3412990db.jpg,客户数据2月,2023-02-18 00:00:00,北外,,,,41
fb-approval-1090,改写后入库,,student,学生库,学生,使用问题,已处理,作业/布置/批改/反馈,老师，学生反馈答案填不进去，是什么原因哇,雅思无法作答,匹配题需要拖动选项,匹配题需要拖动选项,ef74e46ccae4555badc857788f24696c.mp4,企业版用户,2024-05-07 00:00:00,超级学长,,,,40
fb-approval-1091,改写后入库,,student,学生库,学生,使用问题,已处理,作业/布置/批改/反馈,老师这是咋回事呀，实时作业不能答题,学生在实时作业页面，不能答题,老师还没有开启答题,老师，您可以先确认作业是否已经成功布置、学生是否在对应班级内，以及作业状态是否已提交/已完成；如果状态正常但仍看不到，再提供学生账号和作业链接转人工排查。,18d8d0f0ce73e4c1cc791de49c8f6fe.jpg,客户数据2月,2023-02-23 00:00:00,寄托,,,,40
fb-approval-1092,改写后入库,,teacher,老师库,老师,使用问题,已处理,作业/布置/批改/反馈,请问布置的作业逾期了，怎么修改时间啊没有编辑的那种符号,老师修改不了作业时间,能修改自己布置的作业,老师，您可以先确认作业是否已经成功布置、学生是否在对应班级内，以及作业状态是否已提交/已完成；如果状态正常但仍看不到，再提供学生账号和作业链接转人工排查。,66fafbf0800ca3ed7604ceea4a35023.png,企业版用户,2023-11-21 00:00:00,美言,,,,40
fb-approval-1093,改写后入库,,teacher,老师库,老师,使用问题,已处理,作业/布置/批改/反馈,这个智能批改一直显示批改中是为什么呀,作业AI批改一直显示批改中,作业还是进行中，未交卷,老师，您可以先确认作业是否已经成功布置、学生是否在对应班级内，以及作业状态是否已提交/已完成；如果状态正常但仍看不到，再提供学生账号和作业链接转人工排查。,aab1846b41b867d138e9eef02bb9ec3.jpg,企业版用户,2023-11-13 00:00:00,寄托,,,,40
fb-approval-1094,改写后入库,,teacher,老师库,老师,使用问题,已处理,作业/布置/批改/反馈,前面的听读是有分数的，但是后面就没有了,学生口语写作没有评分,未开启写作口语智能批改,未开启写作口语智能批改,855a015034b0021ec88b77c07fc6e46.png,企业版用户,2023-08-12 00:00:00,有鱼,,,,40
fb-approval-1095,改写后入库,,teacher,老师库,老师,使用问题,已处理,作业/布置/批改/反馈,学生登入系统后界面是这样的,学生登陆系统后界面无法做作业,网址不对,老师，您可以先确认作业是否已经成功布置、学生是否在对应班级内，以及作业状态是否已提交/已完成；如果状态正常但仍看不到，再提供学生账号和作业链接转人工排查。,8183a3af1245adf40315f9d1ea7aa33.jpg,企业版用户,2023-07-11 00:00:00,上海心乐美,,,,40
fb-approval-1096,改写后入库,,teacher,老师库,老师,使用问题,已处理,作业/布置/批改/反馈,我后台看到 他是完成了的 但是状态线上是进行中,学生作业已完成，但是现实进行中,学生没有交卷,老师，您可以先确认作业是否已经成功布置、学生是否在对应班级内，以及作业状态是否已提交/已完成；如果状态正常但仍看不到，再提供学生账号和作业链接转人工排查。,21ad1cfe5d953f23465a3aa75fac877.png,企业版用户,2023-03-16 00:00:00,thinkalike,,,,40
fb-approval-1097,改写后入库,,teacher,老师库,老师,操作疑问,已处理,作业/布置/批改/反馈,您好，为什么这个成绩没有出来啊,学生作业没有成绩,老师没有批改,老师，您可以先确认作业是否已经成功布置、学生是否在对应班级内，以及作业状态是否已提交/已完成；如果状态正常但仍看不到，再提供学生账号和作业链接转人工排查。,59da7dc3c9002eef0f6471a77ef0ea8.png,企业版用户,2023-03-03 00:00:00,BMC,,,,40
fb-approval-1098,改写后入库,,teacher,老师库,老师,操作疑问,已处理,作业/布置/批改/反馈,您好， 我们这本词汇书布置单词时还是不能自由布置， 辛苦帮我们看看哈,,单词布置不能重叠,单词布置不能重叠,1b5386d45dbad3152ae0218cff02cda.png,企业版用户,2023-02-23 00:00:00,英廷,,,,40
fb-approval-1099,改写后入库,,teacher,老师库,老师,操作疑问,已处理,作业/布置/批改/反馈,您好 布置了9号的作业 同学们今天就能看到，并进入,,可以布置实时作业,老师，您可以先确认作业是否已经成功布置、学生是否在对应班级内，以及作业状态是否已提交/已完成；如果状态正常但仍看不到，再提供学生账号和作业链接转人工排查。,f6f64c7fb863bb956b9674ac31d8ab4.png,企业版用户,2023-02-08 00:00:00,琢思,,,,40
fb-approval-1100,改写后入库,,teacher,老师库,老师,使用问题,已处理,作业/布置/批改/反馈,请问这个时间为什么显示22.00,,作业截止时间,作业截止时间,e472ffacfea2d6801e022535f8cc740.jpg,企业版用户,2023-02-07 00:00:00,莉创,,,,40
fb-approval-1101,改写后入库,,teacher,老师库,老师,使用问题,已处理,作业/布置/批改/反馈,您好，可以帮忙看一下这个班课嘛，1/28 之后布置的作业我这里都没更新,老师i在作业页面没看到1/28后的作业,老师截图上有1/28之后的作业,老师，您可以先确认作业是否已经成功布置、学生是否在对应班级内，以及作业状态是否已提交/已完成；如果状态正常但仍看不到，再提供学生账号和作业链接转人工排查。,c9b31ac4e28a768b387a8fbf578de47.jpg,企业版用户,2023-02-03 00:00:00,澜大,,,,40
fb-approval-1102,改写后入库,,teacher,老师库,老师,使用问题,已处理,作业/布置/批改/反馈,咱们这个算分系统请核实下，有按照新版打分算么,学生的分数没有按照新托福的分数计算,老师没有布置新托福版本,老师没有布置新托福版本,7e41b495bdc9300c05b1dbcb60c8d45.jpg,企业版用户,2024-05-05 00:00:00,七嘉,,,,40
fb-approval-1103,改写后入库,,teacher,老师库,老师,使用问题,已处理,作业/布置/批改/反馈,你好，为什么这个学生的作业在手机上可以看到，电脑上却显示未开始呢,学生的作业在手机上可以看到，但是电脑端没有,作业有相同的，另一个是完成了的,老师，您可以先确认作业是否已经成功布置、学生是否在对应班级内，以及作业状态是否已提交/已完成；如果状态正常但仍看不到，再提供学生账号和作业链接转人工排查。,"c82d70a4479c840604b16b8162d9470.jpg,ab88a54120b7b63176768dabb218112.jpg",企业版用户,2024-05-11 00:00:00,北京蘑菇,,,,40
fb-approval-1104,改写后入库,,teacher,老师库,老师,使用问题,已处理,作业/布置/批改/反馈,学生都写了 但是后台显示40多未答,学生作业都作答了，但是显示有未答的单词,作业有重复的单词,老师，您可以先确认作业是否已经成功布置、学生是否在对应班级内，以及作业状态是否已提交/已完成；如果状态正常但仍看不到，再提供学生账号和作业链接转人工排查。,"1c33584dcd4d4fe480b4d77e3326d2e.png,e596d18bea0026bf9f71be4f0aa6038.png",企业版用户,2024-08-08 00:00:00,学了么,,,,40
fb-approval-1105,改写后入库,,teacher,老师库,老师,操作疑问,已处理,作业/布置/批改/反馈,您好， 我们这本词汇书布置单词时还是不能自由布置， 辛苦帮我们看看哈,词汇书布置单词时不能自由布置,单词布置不能重叠,单词布置不能重叠,1b5386d45dbad3152ae0218cff02cda.png,客户数据2月,2023-02-23 00:00:00,英廷,,,,40
fb-approval-1106,改写后入库,,teacher,老师库,老师,操作疑问,已处理,作业/布置/批改/反馈,您好 布置了9号的作业 同学们今天就能看到，并进入,老师布置了9号的作业 同学们今天就能看到,可以布置实时作业,老师，您可以先确认作业是否已经成功布置、学生是否在对应班级内，以及作业状态是否已提交/已完成；如果状态正常但仍看不到，再提供学生账号和作业链接转人工排查。,f6f64c7fb863bb956b9674ac31d8ab4.png,客户数据2月,2023-02-08 00:00:00,琢思,,,,40
fb-approval-1107,改写后入库,,teacher,老师库,老师,使用问题,已处理,作业/布置/批改/反馈；题库/录题/单词书/模考,你好 模考写作页面无法编辑，请帮忙看一下,学生写作无法编辑点评,老师端需要登陆系统才能批改,老师端需要登陆系统才能批改,b335f785c05d2f390a8498eb9aeca7d.jpg,企业版用户,2024-05-30 00:00:00,阿基米德,,,,40
fb-approval-1108,改写后入库,,teacher,老师库,老师,使用问题,已处理,作业/布置/批改/反馈；题库/录题/单词书/模考,请问这个时间为什么显示22.00,"模考结果页时间显示2023-2-07-2023-2-07 22：00 ,为什么显示22.00",作业截止时间,作业截止时间,e472ffacfea2d6801e022535f8cc740.jpg,客户数据2月,2023-02-07 00:00:00,莉创,,,,40
fb-approval-1109,改写后入库,,student,学生库,学生,使用问题,已处理,音频/录音/听力,哈喽，老师们好，学生这边音频加载不出来,学生音频加载显示缓冲超时,已发送排查文档,老师，您可以先让学生使用 Chrome 浏览器重新进入，并刷新页面或清理缓存。如果音频超过 15 秒仍未加载，可按页面提示下载音频本地播放；仍不行的话，再提供学生账号、测试链接和截图转人工排查。,b296a954a3ba1bb11583883e055399a.jpg,企业版用户,2023-08-23 00:00:00,享叮咚,,,,39
fb-approval-1110,改写后入库,,teacher,老师库,老师,操作疑问,已处理,权限/角色/公池；题库/录题/单词书/模考,首页上做的入学测试，结果默认是推送到哪里？系统首页右上角有个“入学测试卷”，里面有个“复制链接”功能，这个功能，是不是也能实现分配的效果?,入学测试，结果默认是推送到哪里，“入学测试卷”，里面有个“复制链接”功能，可以实现分配吗,默认推送到系统公池里，如果是销售身份，点击的复制链接，入学模测结果会自动显示在普通销售的公池里,默认推送到系统公池里，如果是销售身份，点击的复制链接，入学模测结果会自动显示在普通销售的公池里,,客户数据5月,2023-05-24 00:00:00,峰杰,,,,39
fb-approval-1111,改写后入库,,teacher,老师库,老师,操作疑问,已处理,权限/角色/公池；题库/录题/单词书/模考；小程序/公众号/二维码,请问一下，在教师端，现在是不是看不到学生的入学模考了？诉求：授课老师不想扫码，想直接能在这个学生的名下找出来TA的入学模考。,,老师是一直看不到入学模考的， 主要考虑数据安全。老师想要看入学模考的话，可以让机构管理员给老师多添加一个身份：(有入学模考身份的教务)或者(销售管理员)。添加了身份后，老师切换身份在用户池中查找学生对应的模考，不用扫码。,老师是一直看不到入学模考的， 主要考虑数据安全。老师想要看入学模考的话，可以让机构管理员给老师多添加一个身份：(有入学模考身份的教务)或者(销售管理员)。添加了身份后，老师切换身份在用户池中查找学生对应的模考，不用扫码。,,企业版用户,2023-02-14 00:00:00,思潮,,,,39
fb-approval-1112,改写后入库,,teacher,老师库,老师,操作疑问,已处理,权限/角色/公池；题库/录题/单词书/模考；小程序/公众号/二维码,请问一下，在教师端，现在是不是看不到学生的入学模考了？诉求：授课老师不想扫码，想直接能在这个学生的名下找出来TA的入学模考。,教师端是不是看不到学生的入学模考,老师是一直看不到入学模考的， 主要考虑数据安全。老师想要看入学模考的话，可以让机构管理员给老师多添加一个身份：(有入学模考身份的教务)或者(销售管理员)。添加了身份后，老师切换身份在用户池中查找学生对应的模考，不用扫码。,老师是一直看不到入学模考的， 主要考虑数据安全。老师想要看入学模考的话，可以让机构管理员给老师多添加一个身份：(有入学模考身份的教务)或者(销售管理员)。添加了身份后，老师切换身份在用户池中查找学生对应的模考，不用扫码。,,客户数据2月,2023-02-14 00:00:00,思潮,,,,39
fb-approval-1113,改写后入库,,academic,教务库,教务,操作疑问,已处理,账号登录/密码/手机号,我有个学生帐号到期了，我忘记在哪里延期了，麻烦告诉我，谢谢,学生账号如何续期,引导查看帮助中心文档,引导查看帮助中心文档,,企业版用户,2023-12-28 00:00:00,守壹私塾,,,,38
fb-approval-1114,改写后入库,,academic,教务库,教务,使用问题,已处理,账号登录/密码/手机号,有个新生我们添加了后，结果一直显示登录失败，辛苦有空帮看看，学生手机号是13621707824,学生登陆不上系统,学生是潜客不是正式学员,学生是潜客不是正式学员,,企业版用户,2023-07-13 00:00:00,上海火箭,,,,38
fb-approval-1115,改写后入库,,academic,教务库,教务,操作疑问,已处理,账号登录/密码/手机号,您好，请问下学员账号到期后可以延期吗？,学员账号到期后如何延期,在学员管理这里可以续期,在学员管理这里可以续期,,企业版用户,2023-06-22 00:00:00,源锐,,,,38
fb-approval-1116,改写后入库,,student,学生库,学生,使用问题,已处理,浏览器/网络/缓存,这个交不了卷，请问是什么回事？,学生逐句精听提交不了,浏览器使用不对,浏览器使用不对,52b0c7ac7e1f436e47225a2b8f55a896.mp4,企业版用户,2023-12-03 00:00:00,问鼎,,,,38
fb-approval-1117,改写后入库,,student,学生库,学生,使用问题,已处理,浏览器/网络/缓存,您好老师，为什么到了语言形式与含义这里下一题就出不来了,学生测试点不了下一题,学生用的微信浏览器,学生用的微信浏览器,54e77481293b1398802efb12f16e9cf.jpg,企业版用户,2023-08-31 00:00:00,峰树,,,,38
fb-approval-1118,改写后入库,,student,学生库,学生,使用问题,已处理,浏览器/网络/缓存,学生的篇章跟读点不了下一句是为什么呢？,学生篇章跟读点不了下一句,学生用的微信浏览器,学生用的微信浏览器,bd4a5b2c4c7e2c1e930706850e1b2bf9.mp4,企业版用户,2023-08-20 00:00:00,曼哈顿,,,,38
fb-approval-1119,改写后入库,,student,学生库,学生,使用问题,已处理,浏览器/网络/缓存,为啥这个学生的写作不显示字数,雅思写作，字数没有显示,浏览器使用不对,浏览器使用不对,d6d1bf0e10c13a2de6f606e281d5751.jpg,企业版用户,2023-06-30 00:00:00,英学,,,,38
fb-approval-1120,改写后入库,,student,学生库,学生,使用问题,已处理,浏览器/网络/缓存,老师你好，我这边有学生反应在系统上完成练习后无法提交成功，请问是什么原因呢,学生反应在系统上完成练习后无法提交成功,学生是用的谷歌浏览器吗,老师，这类情况通常和浏览器兼容性有关，建议学生优先使用 Chrome 浏览器重新进入；如果仍异常，再清理缓存、更换网络后重试。,3819c983f936618aa82c346eb8cdfef.jpg,企业版用户,2023-06-24 00:00:00,思潮,,,,38
